{
  "id": "GHT_STATIC_001",
  "name": "Granny's House Trials Static Prototype",
  "seed": 1,
  "grid_width": 16,
  "grid_height": 12,
  "rule_version": "toy-water-0.1",
  "materials": [
    {
      "id": "STONE_CANAL",
      "diggable": false,
      "base_roughness": 0.2,
      "absorption_rate": 0.0,
      "seepage_rate": 0.0,
      "erosion_resistance": 1.0
    },
    {
      "id": "HARD_DIRT",
      "diggable": true,
      "base_roughness": 0.7,
      "absorption_rate": 0.05,
      "seepage_rate": 0.02,
      "erosion_resistance": 0.6
    },
    {
      "id": "SOIL",
      "diggable": true,
      "base_roughness": 0.9,
      "absorption_rate": 0.15,
      "seepage_rate": 0.06,
      "erosion_resistance": 0.3
    },
    {
      "id": "LAWN",
      "diggable": true,
      "base_roughness": 1.1,
      "absorption_rate": 0.1,
      "seepage_rate": 0.04,
      "erosion_resistance": 0.45
    },
    {
      "id": "LOOSE_BOULDERS",
      "diggable": false,
      "base_roughness": 1.3,
      "absorption_rate": 0.02,
      "seepage_rate": 0.01,
      "erosion_resistance": 0.25
    },
    {
      "id": "HOUSE_FOUNDATION",
      "diggable": false,
      "base_roughness": 99,
      "absorption_rate": 0.0,
      "seepage_rate": 0.0,
      "erosion_resistance": 1.0
    },
    {
      "id": "GARDEN_SOIL",
      "diggable": true,
      "base_roughness": 0.9,
      "absorption_rate": 0.2,
      "seepage_rate": 0.05,
      "erosion_resistance": 0.25
    }
  ],
  "cells": [],
  "features": [],
  "goals": [
    {
      "id": "G1",
      "type": "primary",
      "metric_name": "old_garden_hydration",
      "comparison": ">=",
      "threshold": 70
    },
    {
      "id": "G2",
      "type": "primary",
      "metric_name": "new_garden_hydration",
      "comparison": ">=",
      "threshold": 70
    },
    {
      "id": "S1",
      "type": "safety",
      "metric_name": "basement_dampness",
      "comparison": "<",
      "threshold": 30
    },
    {
      "id": "S2",
      "type": "safety",
      "metric_name": "boulder_wall_stability",
      "comparison": ">",
      "threshold": 50
    }
  ],
  "happy_paths": [
    {
      "ref": "happy_path_001.json"
    }
  ],
  "trap_scripts": [
    {
      "ref": "trap_straight_downhill_001.json"
    }
  ],
  "metadata": {
    "description": "Example skeleton. Codex should fill or generator should create complete cells/features."
  }
}
